News,InfSec,FAKE?,Link
"По данным Forbes, осенью в России может появиться система защиты от DDoS-атак, действующая в масштабах всей страны. С этой целью Роскомнадзор задумал обновить оборудование, которое сейчас используется для глубокой фильтрации трафика (DPI) в исполнение закона о суверенном интернете.

Решение РКН вызвано ростом числа хактивистских DDoS-атак в рунете, особенно на уровне приложений — к таким нападениям многие отечественные компании оказались не готовы. Ситуацию усугубляет уход с российского рынка многих иностранных провайдеров услуг по блокировке DDoS.

По этим причинам власти сейчас прорабатывают различные сценарии защиты национального сегмента интернета от внешних угроз. Регулятор, со своей стороны, предложил использовать для этих нужд существующее оборудование — DPI-системы, установленные у крупных операторов связи для обеспечения бесперебойной работы рунета (именно их в прошлом году использовали для замедления Twitter).

Как выяснил Forbes, эти решения уже обладают необходимой функциональностью, но умеют реагировать лишь на несколько типов DDoS-атак — по сигнатурам, созданным в ГРЧЦ, Главном радиочастотном центре при Роскомнадзоре. Чтобы использовать такие продукты для фильтрации и блокировки DDoS-потоков на национальном уровне, придется расширить набор соответствующих сигнатур в системах DPI и повсеместно сделать эту услугу доступной.

Не исключено, что централизация защиты от DDoS потребует создания новых центров мониторинга и очистки трафика. Роскомнадзор планирует также в несколько раз увеличить пропускную способность DPI-оборудования, В настоящее время эти системы способны одновременно фильтровать потоки до 100 Гбит/с.

Модернизацию существующей DPI-инфраструктуры регулятор хочет провести в рамках действующих контрактов, без дополнительных капиталовложений. Однако из-за санкций и проблем с логистикой стоимость производства такого оборудования, по данным Forbes, выросла почти на 40%. Детали проекта РКН уже обсуждает с поставщиком DPI-систем — компанией Research & Development Partners (RDP.RU, с прошлого года собственность «Ростелекома»).",1,0,https://www.anti-malware.ru/news/2022-04-18-114534/38539
"ZingoStealer — новый вредонос, похищающий важные данные жертв, теперь предлагается совершенно бесплатно киберпреступникам разных мастей. Дело в том группировка Haskers Gang сначала пыталась продать исходный код за 500 долларов, но потом решила отдать его безвозмездно.

Помимо этого, злоумышленники предлагают за 300 рублей собственный шифровальщик ExoCrypt, который может помочь хакерам уйти от детектирования антивирусными средствами. Haskers Gang действует как минимум с января 2020 года.

Пробравшись в скомпрометированную систему, ZingoStealer ищет важную информацию и параллельно использует ресурсы устройства для майнинга криптовалюты Monero. Вредоносный код может собирать метаданные системы, а также информацию, сохранённую в популярных браузерах: Google Chrome, Mozilla Firefox, Opera и Opera GX.

Данные криптовалютных кошельков также интересуют зловреда. Специалисты Cisco Talos опубликовали отчёт, в котором описывают киберугрозу следующим образом:

«Вредонос “ZingoStealer” может не только похищать данные жертвы, но и загружать дополнительного зловреда в заражённые системы. Например, в ряде случаев на помощь призывался RedLine».

Исследователи отметили, что ZingoStealer нацелен преимущественно на русскоговорящих жертв. Также интересно, что инфостилер использует Telegram для извлечения данных и выдачи обновлений компонентов. Каналом распространения служат серверы Discord, ориентированные на геймеров.

Напомним, что на днях мы рассказывали о распространении другого инфостилера — META (не путать с организацией Meta, признанной в России экстремисткой). По словам экспертов, он стал улучшенной версией RedLine.",1,0,https://www.anti-malware.ru/news/2022-04-18-111332/38538
"Как стало известно «Ъ», расследование деятельности предполагаемых участников группировки REvil, об аресте которых в январе сообщила ФСБ России, приостановилось. Американские коллеги так и не предоставили информации о жертвах и причиненном ущербе, поэтому подозреваемых можно обвинить только махинациях с банковскими картами двух граждан США, разыскать которых не представляется возможным.

Напомним, аресты в России были проведены с подачи американцев в рамках сотрудничества двух стран по вопросам кибербезопасности. В ходе недавнего интервью замглавы Совбеза РФ Олег Храмов рассказал «Российской газете», что в прошлом году заокеанские партнеры попросили под любым предлогом арестовать «главного хакера» — россиянина по фамилии Пузыревский, и предоставили его IP-адрес.

Российским спецслужбам удалось выяснить, что речь идет о рестораторе Данииле Пузыревском из Санкт-Петербурга. Попутно были идентифицированы 13 предполагаемых соучастников операций REvil, а также установлены две жертвы. Ими оказались проживающие в США мексиканцы, у которых подозреваемые, по версии следствия, дистанционно украли деньги, впоследствии потратив их в интернет-магазинах, с оплатой товаров по электронным средствам связи.

В России возбудили уголовное дело в соответствии с ч. 2 ст. 187 УК (неправомерное использование средств платежа в составе преступной группы), однако на том все и остановилось. Американская сторона, по словам Храмова, так и не предоставила обещанных дополнительных доказательств и даже не подтвердила ущерб от вымогательства. Более того, россиянам сообщили, что США в одностороннем порядке выходят из совместной рабочей группы и закрывают канал связи.

Адвокат одного из задержанных решил воспользоваться затишьем и добиться освобождения своего клиента. С этой целью он обратился к Храмову, отметив, что в уголовном деле до сих пор нет потерпевших и не указан ущерб, причиненный обвиняемыми. Допросов в СИЗО не проводится, поэтому защита просит генерала посодействовать в изменении меры пресечения, а затем — в прекращении уголовного преследования.

«На мой взгляд, разумным выходом из этой ситуации была бы сделка обвиняемых с Генпрокуратурой, — заявил «Ъ» автор прошения Игорь Вагин. — В ее рамках фигуранты получили бы освобождение от уголовной ответственности».

Адвокат также отметил, что изъятые денежные средства по условиям сделки могли бы быть потрачены на благие нужды, а «уникальный опыт» фигурантов дела наверняка пригодился бы российским спецслужбам.",1,0,https://www.anti-malware.ru/news/2022-04-18-111332/38536
"Киберпреступники запустили новую торговую онлайн-площадку Industrial Spy, на которой будут продаваться данные, украденные в ходе атак на организации. Industrial Spy рекламируют как место, где бизнес может приобрести коммерческую тайну конкурентов и базы данных клиентов.

Также злоумышленники могут использовать новую торговую площадку, чтобы склонить жертв кибератак приобрести свои данные. Если условную организацию не удалось заставить заплатить выкуп, мошенники могут пригрозить продать внутреннюю информацию третьим лицам.

На Industrial Spy можно приобрести данные класса «premium», стоимость которых будет достигать миллионы долларов, однако там же можно купить и совсем недорогие сведения в виде отдельных файлов, каждый из которых стоит два доллара.

Например, в настоящий момент площадка продаёт внутренние данные одной индийской компании из категории «премиум». Цена — 1,4 млн долларов. За БД придётся заплатить в биткоинах.

Дешёвая информация, как уже отмечалось выше, продаётся в виде отдельных файлов, за каждый из которых надо выложить $2.

Команда MalwareHunterTeam впервые наткнулась на упоминание Industrial Spy после анализа вредоносной программы, оставляющей файл README.txt. Именно в этих текстовых файлах рекламировалась торговая площадка.

Позже выяснилось, что такие зловреды маскируются под кряки и рекламные программы.",1,0,https://www.anti-malware.ru/news/2022-04-18-111332/38535
"Как стало известно «Ъ», расследование деятельности предполагаемых участников группировки REvil, об аресте которых в январе сообщила ФСБ России, приостановилось. Американские коллеги так и не предоставили информации о жертвах и причиненном ущербе, поэтому подозреваемых можно обвинить только махинациях с банковскими картами двух граждан США, разыскать которых не представляется возможным.

Напомним, аресты в России были проведены с подачи американцев в рамках сотрудничества двух стран по вопросам кибербезопасности. В ходе недавнего интервью замглавы Совбеза РФ Олег Храмов рассказал «Российской газете», что в прошлом году заокеанские партнеры попросили под любым предлогом арестовать «главного хакера» — россиянина по фамилии Пузыревский, и предоставили его IP-адрес.

Российским спецслужбам удалось выяснить, что речь идет о рестораторе Данииле Пузыревском из Санкт-Петербурга. Попутно были идентифицированы 13 предполагаемых соучастников операций REvil, а также установлены две жертвы. Ими оказались проживающие в США мексиканцы, у которых подозреваемые, по версии следствия, дистанционно украли деньги, впоследствии потратив их в интернет-магазинах, с оплатой товаров по электронным средствам связи.

В России возбудили уголовное дело в соответствии с ч. 2 ст. 187 УК (неправомерное использование средств платежа в составе преступной группы), однако на том все и остановилось. Американская сторона, по словам Храмова, так и не предоставила обещанных дополнительных доказательств и даже не подтвердила ущерб от вымогательства. Более того, россиянам сообщили, что США в одностороннем порядке выходят из совместной рабочей группы и закрывают канал связи.

Адвокат одного из задержанных решил воспользоваться затишьем и добиться освобождения своего клиента. С этой целью он обратился к Храмову, отметив, что в уголовном деле до сих пор нет потерпевших и не указан ущерб, причиненный обвиняемыми. Допросов в СИЗО не проводится, поэтому защита просит генерала посодействовать в изменении меры пресечения, а затем — в прекращении уголовного преследования.

«На мой взгляд, разумным выходом из этой ситуации была бы сделка обвиняемых с Генпрокуратурой, — заявил «Ъ» автор прошения Игорь Вагин. — В ее рамках фигуранты получили бы освобождение от уголовной ответственности».

Адвокат также отметил, что изъятые денежные средства по условиям сделки могли бы быть потрачены на благие нужды, а «уникальный опыт» фигурантов дела наверняка пригодился бы российским спецслужбам.",1,0,https://www.anti-malware.ru/news/2022-04-18-111332/38534
"Исследователи из VMware опубликовали результаты анализа RURansom —зловреда, шифрующего файлы на российских Windows-машинах без возможности возврата. Его автор не скрывает, что создал программу, способную уничтожать данные и резервные копии, с целью причинить ущерб России.

Написанный на .NET вредонос RURansom появился в поле зрения ИБ-экспертов в начале прошлого месяца. Сначала об обнаружении необычного шифровальщика сообщила команда MalwareHunterTeam, затем последовали развернутые публикации Trend Micro и Cyble.

Исследование, проведенное в VMware, подтвердило результаты, полученные коллегами-аналитиками. При запуске RURansom вызывает функцию IsRussia() для проверки IP-адреса и геолокации зараженной системы (выполняется с использованием API легитимных веб-сервисов). Если жертва находится за пределами России, зловред отображает сообщение «Программу могут запускать только российские пользователи» и завершает свое исполнение.

В противном случае наступает следующий этап — проверка прав текущего пользователя. Если уровень ниже администратора, RURansom использует PowerShell для запуска командлета Start-Process, чтобы повысить привилегии.

По завершении всех проверок вредонос начинает собирать информацию о доступных носителях. Обнаружив съемное или подключенное сетевое хранилище, он оставляет там свою копию (с именем Россия-Украина_Война-Обновление.doc.exe); на диске C: шифруется только содержимое папки текущего пользователя.

На остальных найденных жестких дисках зловред шифрует все подряд. Исключение составляют только файлы конфигурации запущенных приложений (хранятся в %AppData%), а также резервные копии (файлы .bak) — эти он беспощадно удаляет, чтобы воспрепятствовать восстановлению данных.

Для шифрования используется AES в режиме CBC, с добавлением вшитой в код соли. Для каждого файла создается свой ключ, который потом кодируется по base64 и нигде не сохраняется — это делает шифрование необратимым. После преобразования расширение файла меняется на .fs_invade.

Во всех папках с зашифрованными данными создается файл Полномасштабное_кибервторжение.txt. В этой русскоязычной записке указано, что RURansom создан с целью навредить России. Способа расшифровки не существует, никакой платы тоже не требуется. Примечательна заключительная фраза — «переведено с бангла [бенгали] на русский с помощью Google Translate». Никаких доказательств того, что это именно так, не найдено.

Новоявленного вредителя детектирует большинство антивирусов из коллекции VirusTotal. Данных о заражениях пока нет.

Обнаружены также другие творения автора RURansom — загрузчик для криптомайнера XMRig и еще один деструктор, с говорящим именем dnWipe. Последний примечателен тем, что исполняется только во вторникам; он просто кодирует по base64 содержимое файлов .doc, .docx, .png, .gif, .jpeg, .jpg, .mp4, .txt, .flv, .mp3, .ppt, .pptx, .xls и .xlsx — расшифровка в этом случае не составит труда.",1,0,https://www.anti-malware.ru/news/2022-04-15-114534/38532
