News,InfSec,FAKE?,Link
"Неизвестные хакеры проникли на сайт store.segway[.]com и внедрили в него JavaScript, загружающий веб-скиммер. В Malwarebytes полагают, что за атакой стоит одна из группировок Magecart; вендора электросамокатов уже уведомили об опасной находке.

Компрометация сайта Segway-Ninebot, по данным ИБ-компании, произошла 6 января. По состоянию на понедельник, 24 января, вредоносный код все еще работал, и эксперты решили опубликовать свою находку, чтобы предупредить онлайн-шоперов об угрозе.

Каким образом злоумышленники осуществили взлом, установить не удалось. Интернет-магазин Segway работает на Magento; не исключено, что авторы атаки использовали какую-то уязвимость в самой CMS или ее плагине.

Вредоносный JavaScript-загрузчик выдается за код, отображающий информацию о копирайте. Он скачивает полезную нагрузку с уже засветившегося в атаках сервера (домен booctstrap[.]com) — в виде фавикона, содержащего код веб-скиммера. Последний активируется, когда посетитель store.segway.com заходит на страницу оформления заказа.

Изучив код веб-скиммера, аналитики пришли к заключению, что автором атаки скорее всего является Magecart 12. Согласно данным телеметрии Malwarebytes, больше половины потенциальных жертв этой кибергруппы (55%) проживают в США, 39% — в Австралии, остальные — в Канаде, Великобритании и Германии.",0,0,https://www.anti-malware.ru/news/2022-01-26-114534/38060
"Кредитные организации в России отметили рост интереса киберпреступников к онлайн-приложениям. В качестве логичного ответа банки планируют усилить свои системы для борьбы с мошенничеством (антифрод) и таким образом обезопасить клиентов.

Ряд экспертов в области кибербезопасности прогнозировал увеличение числа атак на клиентов кредитных организаций. Одной из компаний, которые предупреждали об этом, стала Positive Technologies, отметившая эту тенденцию в своих недавних прогнозах.

Представители банков со своей стороны наблюдают рост количества клиентов, активно пользующихся дистанционным банковским обслуживанием (ДБО). Также в кредитных организациях согласились с прогнозами ИБ-специалистов — смещение фокуса кибермошенников на онлайн-банкинг спрогнозировал, например, Михаил Иванов из Росбанка в беседе с «РИА Новости».

Из-за сложившейся ситуации главы ИБ-отделов российских банков считают важным усилить работу антифрод-систем, чтобы максимально обезопасить клиентов от действий злоумышленников. Есть также мнение, что взламывать приложения для киберпреступников будет гораздо сложнее, чем работать непосредственно с клиентом (введение в заблуждение).

Поскольку современные технологии позволяют оформить кредит в самих приложениях, мошенники чаще смотрят в сторону именно онлайн-кредитов, чтобы впоследствии вывести средства на свои счета.

Клиентам кредитных организаций стоит всегда помнить об элементарных правилах: не сообщать по телефону никаких данных для взвода, паролей и любой другой конфиденциальной информации; не устанавливать на мобильное устройство сомнительные программы, репутация которых под большим вопросом.",0,0,https://www.anti-malware.ru/news/2022-01-26-111332/38057
"Представители Минцифры сообщили, что уже изучают опубликованную информацию об утечке сведений из приложения «Госуслуги стоп коронавирус». Персональным данным граждан ничего не угрожает, отметили в ведомстве.

Первым на возможный слив сведений указал ряд каналов в Telegram, одним из которых был «Утечки информации». По сведениям информаторов, на онлайн-площадках дарквеба появились в продаже данные из приложения «Госуслуги стоп коронавирус».

Семпл слитой БД показал, что ПДн в открытом виде в утечке нет. Тем не менее исследователи нашли там первые буквы имени и фамилии граждан, дату рождения, а также несколько открытых цифр серии и номера паспорта.

Издание «Медиазона» (признано иностранным средством массовой информации, выполняющим функции иностранного агента) отметило, что ещё летом 2021 года «Ростелекому» и Минцифры была направлена информация об уязвимости, которая может привести к утечке. Однако даже к середине декабря никто не закрыл брешь.

Только сейчас, согласно размещённой ТАСС заметке, министерство начало проверку.

«Минцифры проверяет сообщения об утечке обезличенных данных из приложения ""Госуслуги стоп коронавирус"". В опубликованной БД нет персональных данных граждан, а фигурирующие QR-коды показали неработоспособность», — комментируют представители ведомства.

Напомним, что в середине месяца Минцифры предупредило россиян о мошеннической схеме, в ходе которой злоумышленники просят россиян назвать код из СМС-сообщения для доступа к учётной записи на «Госуслугах».",0,0,https://www.anti-malware.ru/news/2022-01-26-111332/38054
"Очередные хакеры попали в руки российских правоохранителей. На этот раз стало известно, что ФСБ России задержало четверых членов киберпреступной группировки The Infraud Organization. Согласно информации в СМИ, лидера группы арестовали, а других троих участников отправили под домашний арест.

Основателем The Infraud Organization оказался Андрей Новак, которого в Штатах объявили в розыск по подозрению в кибермошеннических операциях. Информатор ТАСС сообщил, что правоохранители арестовали Новака.

Как отметили источники издания, основной доход группировке приносила кража данных банковских карт. Стражи правопорядка также назвали имена троих предполагаемых членов, отправленных под домашний арест: Марк Аврамович Бергман, Кирилл Самокутяев и Константин Владимирович Бергман.

Сейчас правоохранительные органы устанавливают других участников «хакерского» объединения The Infraud Organization. По имеющимся у ТАСС данным, Россия не планирует выдавать Новака западным коллегам.

Если же в ходе оперативно-разыскной деятельности полиция задержит человека без гражданства РФ, его экстрадируют в родную страну, где ему предъявят обвинения.

Напомним, что на прошлой неделе ФСБ России ликвидировала кибергруппировку REvil, чему поспособствовали правоохранители США, указавшие на лидера группы.",0,0,https://www.anti-malware.ru/news/2022-01-24-111332/38020
"Исследователи в области кибербезопасности обнаружили новый вредонос MoonBounce, отличающийся своей сложностью и работой на уровне прошивки UEFI. По словам специалистов, оператором зловреда является китайская кибергруппировка APT41 (Winnti).

Группа APT41 хорошо известна экспертам, поскольку действует как минимум на протяжении десяти лет. Злоумышленники занимаются в основном организацией кибершпионских операций против крупных организаций различных промышленных секторов.

Выявить вредонос MoonBounce удалось специалистам антивирусной компании «Лаборатория Касперского», которые уже успели подготовить отчёт о кампаниях, в которых он фигурирует.

Для тех, кто не знает, уточним, что UEFI (Unified Extensible Firmware Interface, единый интерфейс расширяемой прошивки) предназначен для связи операционной системы с микропрограммами, которые управляют низкоуровневыми функциями оборудования.

Если условный киберпреступник поместит «UEFI-буткит» в прошивку, ему не смогут ничего противопоставить антивирусы, работающие на уровне операционной системы. До MoonBounce к этому же приёму прибегали вредоносы FinFisher и ESPecter.

Таким зловредам удаётся запуститься ещё до компонентов безопасности ОС, именно поэтому их впоследствии крайне сложно удалить. MoonBounce, например, располагается в SPI-памяти материнской платы, поэтому даже замена жёсткого диска не удалит зловред.

Бэкдор использует компонент прошивки, известный под именем CORE_DXE, — он вызывается на ранней стадии цепочки загрузки UEFI.",0,0,https://www.anti-malware.ru/news/2022-01-21-111332/38009
"Присутствие компании «ИнфоТеКС» в США озаботило федеральных следователей, которые считают, что такое положение дел может угрожать кибербезопасности целой страны. Об этом говорится в расследовании американского издательства Forensic News.

Внимание Forensic News почему-то привлекло наличие у «ИнфоТеКС» лицензий, выданных ФСБ России (перечислены на официальном сайте компании). Как пишет издание, ссылаясь на одного из сотрудников российской компании, среди американских клиентов «ИнфоТеКС» были Cigna, Ратгерский университет и Медицинский центр Университета Хакенсак.

По мнению американцев, наличие лицензий ФСБ может указывать на предположительную связь «ИнфоТеКС» с российскими спецслужбами. В связи с этим кажется подозрительным, что «ИнфоТеКС» уже более 20 лет поддерживает работу юридических лиц на территории США.

Согласно опубликованному Forensic News расследованию, представители издания в течение полугода собирали документы из различных юрисдикций в США и за рубежом. Помимо этого, сотрудники общались с рядом источников, якобы знакомых с деятельностью «ИнфоТеКС». После этого Forensic News решило поднять шум по поводу того, почему «тесно связанная с российским правительством компания работает в США».

Также издание ссылается на бездоказательное присутствие бэкдоров в шифровании «ИнфоТеКС», которые якобы могут использоваться киберпреступниками. В этом ключе упоминается давний отчёт Motherboard, в котором описываются уязвимости российских алгоритмов шифрования «Кузнечик» и «Стрибог».

Представители «ИнфоТеКС» направили в редакцию Anti-Malware.ru официальный комментарий и объяснили свою позицию по данному вопросу.",0,0,https://www.anti-malware.ru/news/2022-01-21-111332/38006
"Очередной ребрендинг среди гигантов сферы кибербезопасности. Cтало известно, что на базе объединенной компании McAfee Enterprise и FireEye запущен новый бренд Trellix. Под этим новым названием компания сфокусируется на обеспечении расширенного обнаружения киберугроз и реагирования на них с упором на ускорение технологических инноваций с помощью машинного обучения и автоматизации.

В прошлом году консорциум, который возглавляет инвестиционная компания Symphony Technology Group (STG), купил имя и бизнес FireEye за 1.2 миллиарда долларов. Также в марте за 4 миллиарда долларов McAfee продала бизнес Enterprise в сфере корпоративной безопасности той же STG. Слияние двух гигантов завершилось в октябре 2021.

По словам новой компании Trellix их специалисты будут работать над так называемой «живой безопасностью», которая будет учиться и адаптироваться для защиты бизнеса от современных подготовленных киберпреступников. Согласно имеющейся информации, Trellix будет обслуживать 40 тысяч клиентов, а в штат войдут около пяти тысяч сотрудников.

Представители STG отметили, что планируют запустить часть портфолио McAfee Enterprise, Secure Service Edge (SSE), как отдельный бизнес в ближайшее время.",0,0,https://www.anti-malware.ru/news/2022-01-20-111332/38001
"Не прошло и полгода с момента выхода iOS 15, а Apple уже отказывается выпускать патчи для пользователей iOS 14. Таким образом, видимо, корпорация пытается максимально быстро «перевести» как можно больше людей на последнюю версию операционной системы.

Интересно, что Apple, представляя iOS 15, отмечала, что этот релиз вовсе не обязателен для установки. Другими словами, те пользователи, которые хотят остаться на iOS 14, не встретят никаких проблем.

Однако издание 9to5Mac отметило, что апдейт под номером iOS 14.8.1 перестал быть доступным для пользователей iOS 14. Единственная возможность — обновиться до текущей версии iOS 15 (15.2.1).

Теперь Ars Technica выяснила, что здесь нет никакой ошибки — iOS 14 больше не будет обновляться. То есть всем, кому важны выходящие патчи, необходимо установить iOS 15 и, соответственно, смириться со всеми нововведениями этой версии мобильной ОС.

Как отметила сама Apple, в планы корпорации никогда не входила долгая поддержка iOS 14. Хотите вы этого или нет, всё равно придётся обновляться до следующего мажорного релиза, так как разработчики сосредоточатся на патчинге актуальной версии.

Специалисты считают, что купертиновцам стоит более прозрачно доносить свои планы до пользователей. Если для iOS 12 до сих пор периодически выходят обновления безопасности, почему бы не поддерживать iOS 14 хотя бы год?",0,0,https://www.anti-malware.ru/news/2022-01-20-111332/37999
"Компания Group-IB, занимающаяся борьбой с киберпреступностью, поучаствовала вместе с Интерполом, Palo Alto Networks и правоохранительными органами Нигерии в совместной операции, которая привела к задержанию 11 граждан. Арестованные подозреваются в организации кибератак на корпоративную почту (Business Email Compromise, BEC).

Как отметили специалисты, 11 задержанных являются членами киберпреступной группировки, известной под именем TMT (SilverTerrier). Исследователи наблюдают за этой группой с 2019 года.

Международная операция Falcon II стала продолжением Falcon I. Правоохранителям удалось изъять устройства, на которых хранились файлы злоумышленников. Чуть позже Group-IB провела криминалистический анализ этих файлов.

Falcon II заняла 10 дней — с 13 по 22 декабря 2021 года. Представители Интерпола отметили, что аресту очень поспособствовал оперативный обмен данными киберразведки. По данным правоохранителей, подозреваемые связаны с компрометацией корпоративной электронной почты, затронувшей более 50 тысяч жертв.

У одного из арестованных на ноутбуке нашли более 800 тысяч учётных данных, которые, предположительно, принадлежат жертвам кибератак.",0,0,https://www.anti-malware.ru/news/2022-01-19-111332/37994
