News,InfSec,FAKE?,Link
"Как стало известно «Ъ», расследование деятельности предполагаемых участников группировки REvil, об аресте которых в январе сообщила ФСБ России, приостановилось. Американские коллеги так и не предоставили информации о жертвах и причиненном ущербе, поэтому подозреваемых можно обвинить только махинациях с банковскими картами двух граждан США, разыскать которых не представляется возможным.

Напомним, аресты в России были проведены с подачи американцев в рамках сотрудничества двух стран по вопросам кибербезопасности. В ходе недавнего интервью замглавы Совбеза РФ Олег Храмов рассказал «Российской газете», что в прошлом году заокеанские партнеры попросили под любым предлогом арестовать «главного хакера» — россиянина по фамилии Пузыревский, и предоставили его IP-адрес.

Российским спецслужбам удалось выяснить, что речь идет о рестораторе Данииле Пузыревском из Санкт-Петербурга. Попутно были идентифицированы 13 предполагаемых соучастников операций REvil, а также установлены две жертвы. Ими оказались проживающие в США мексиканцы, у которых подозреваемые, по версии следствия, дистанционно украли деньги, впоследствии потратив их в интернет-магазинах, с оплатой товаров по электронным средствам связи.

В России возбудили уголовное дело в соответствии с ч. 2 ст. 187 УК (неправомерное использование средств платежа в составе преступной группы), однако на том все и остановилось. Американская сторона, по словам Храмова, так и не предоставила обещанных дополнительных доказательств и даже не подтвердила ущерб от вымогательства. Более того, россиянам сообщили, что США в одностороннем порядке выходят из совместной рабочей группы и закрывают канал связи.

Адвокат одного из задержанных решил воспользоваться затишьем и добиться освобождения своего клиента. С этой целью он обратился к Храмову, отметив, что в уголовном деле до сих пор нет потерпевших и не указан ущерб, причиненный обвиняемыми. Допросов в СИЗО не проводится, поэтому защита просит генерала посодействовать в изменении меры пресечения, а затем — в прекращении уголовного преследования.

«На мой взгляд, разумным выходом из этой ситуации была бы сделка обвиняемых с Генпрокуратурой, — заявил «Ъ» автор прошения Игорь Вагин. — В ее рамках фигуранты получили бы освобождение от уголовной ответственности».

Адвокат также отметил, что изъятые денежные средства по условиям сделки могли бы быть потрачены на благие нужды, а «уникальный опыт» фигурантов дела наверняка пригодился бы российским спецслужбам.",1,0,https://www.anti-malware.ru/news/2022-05-27-114534/38773
"Эксперты Eclypsium обнаружили, что серверы от Quanta Cloud Technology тоже уязвимы к атакам Pantsdown (англ. «застать врасплох»), об угрозе которых стало известно еще в 2019 году. Проблема связана с наличием критической уязвимости в BMC-контроллерах, которая позволяет захватить контроль над хостом и получить доступ к другим серверам в сети.

Микроконтроллеры BMC (Baseboard Management Controller) широко используются для удаленного управления серверными платформами. Они устанавливаются на материнской плате или подключаются как плата расширения по шине PCI и всегда активны, вне зависимости от состояния хост-сервера.

Уязвимость CVE-2019-6260 (9,8 балла CVSS), получившая известность как Pantsdown, позволяет получить удаленный доступ на чтение / запись к физическому пространству адресов BMC и выполнить любой код на сервере. В случае успешного эксплойта злоумышленник сможет украсть важные данные, перезаписать прошивку, развернуть руткит, вывести из строя хост-сервер и добраться до других серверов в той же группе IPMI — например, для внедрения в сеть шифровальщика.

После того, как стало известно об опасной находке (январь 2019), несколько крупных производителей серверных продуктов проверили свои портфолио и опубликовали информационные бюллетени, в том числе Supermicro, IBM, HP и Gigabyte. В прошлом году выяснилось, что проблема также затрагивает серверы QCT — решения для ЦОД, которые используют, в частности, Facebook и Rackspace.

Специалисты Eclypsium создали PoC-эксплойт для Pantsdown, который успешно отработал на QuantaGrid D52B с новейшей публично доступной прошивкой. Вендору сообщили о проблеме в октябре; в прошлом месяце вышло соответствующее обновление, которое распространяется в частном порядке — публикации, как узнали авторы отчета, не предвидится.

Из-за этого в Eclypsium не смогли определить, сколько QCT-серверов все еще под угрозой. Известно только, что Pantsdown актуальна для моделей D52BQ-2U, D52BQ-2U 3UPI и D52BV-2U, которые используют уязвимую версию BMC (4.55.00). Во избежание таких неприятностей, как iLOBleed, пользователям рекомендуют своевременно обновлять прошивки и регулярно проверять их на наличие признаков компрометации.",1,0,https://www.anti-malware.ru/news/2022-05-27-114534/38772
"Российский рынок информационной безопасности нуждается в базе совместимых решений. Эксперты обсудили импортозамещение на конференции AM Camp «Национальная платформа кибербезопасности».

Игрокам ИБ сегодня не хватает скоординированности и совместимости продуктов и сервисов. Весенние указы президента усиливают контроль над отраслью и требуют экстренного перехода на «своё».

Мигрировать на отечественных вендоров, надеяться на возвращение американцев или не делать ничего — участники майского AM Camp обсудили возможные стратегии работы.

«Все вернутся рано или поздно, — считает Александра Савельева из «АВ Софт». — Можно ждать, но ситуация опять может повториться. Доверия больше нет!».

Основная проблема импортозамещения связана с интеграцией российских продуктов в экосистему, их совместимость с другими программами и эффективность работы.

Сейчас идет точечная замена зарубежных решений отечественными аналогами. Игроки не готовы полностью отказаться от «санкционки», несмотря на моновендорную альтернативу.

«Нужно ли класть все яйца в одну корзину или лучше создавать своего “Франкенштейна“ из разных решений?», — задаётся вопросом Алексей Лукацкий, модератор дискуссии «Стратегия и тактика перехода на российские решения». «Моносистема — идеальный вариант, — отвечает глава департамента информационной безопасности М.Видео-Эльдорадо Александр Орешков, — но сейчас это невозможно».

С ним согласен Денис Горчаков из Ростелекома:

«У любого вендора есть продукты, которые лучше или хуже».

По словам Александра Луганцева (АО ВТБ Специализированный депозитарий ВТБ), принципиальны два ключевых аспекта: работоспособность и стоимость такой моносистемы.

«Пока с этим сложно, — признаётся Луганцев. — Цена становится неприемлемой для бизнеса и приходится выбирать решения дешевле».

При этом возникает еще одна проблема — несовместимость продуктов от разных разработчиков. В кулуарах AM Camp эксперты жаловались на такие несостыковки.

Отрасли не хватает объединенной базы, в которой бы содержалась информация, что и с чем «летает» у отечественного вендора.

«Важно мыслить и выстраивать саму экосистему ИБ, а не просто латать дыры», — подводит итог Константин Родин из «АйТи БАСТИОН».

Эфир AM Camp состоялся накануне. В один день прошли три дискуссии на тему «Национальная платформа кибербезопасности».",1,0,https://www.anti-malware.ru/news/2022-05-27-118537/38771
"Тайваньский производитель сетевого оборудования Zyxel выпустил патчи, которые должны устранить четыре уязвимости, затрагивающие межсетевой экран, технологию AP Controller и AP-продукты. По словам разработчиков, эти бреши могут привести к выполнению команд на уровне ОС, а также к краже информации.

На официальном сайте Zyxel приводятся следующие сведения по поводу выявленных и устранённых уязвимостей:

CVE-2022-0734 — межсайтовый скриптинг (XSS) в отдельных версиях файрвола. Этот баг можно использовать для получения доступа к информации, хранящейся в браузере пользователя: файлам cookies, токенам сессий и т. п. Для эксплуатации достаточно написать вредоносный скрипт.

CVE-2022-26531 — под этим идентификатором объединили несколько проблем, связанных с проверкой ввода в командах CLI (command line interface, «интерфейс командной строки»). Эти дыры можно использовать для вызова сбоев в работе системы.

CVE-2022-26532 — возможность инъекции команд в “packet-trace“, что может привести к выполнению кода.

CVE-2022-0910 — позволяет обойти процесс аутентификации, после чего злоумышленник может заменить 2FA на один фактор (даунгрейд).

Стоит учесть, что патч для CVE-2022-26531 и CVE-2022-26532 в AP Controller можно установить только после обращения к соответствующим командам техподдержки Zyxel.",1,0,https://www.anti-malware.ru/news/2022-05-27-111332/38770
"В последние дни ходили слухи, что техногигант Broadcom заинтересован в покупке VMware. Как оказалось, это правда — корпорация объявила о приобретении VMware за сумму в 61 миллиард долларов.

Как отмечает издание TechCrunch, сделка осуществляется в форме как денежных средств, так и акций. Broadcom при этом возьмёт на себя долг VMware, который на текущий момент равен восьми миллиардам долларов.

За счёт VMware Broadcom планирует развивать не только виртуализацию, но и контейнеризацию (с помощью Heptio). Также техногиганту перейдёт Pivotal (часть VMware с 2019 года), помогающая предоставлять клиентам услуги поддержки при переходе на современные технологии.

К слову, ранее аналитики гадали, кто же именно приобретёт VMware. Первыми в списке возможных покупателей были Intel и Dell.

Тем не менее руководство VMware в лице генерального директора считает слияние активов и специалистов двух компаний положительным итогом.",1,0,https://www.anti-malware.ru/news/2022-05-27-111332/38769
"Как стало известно «Ъ», расследование деятельности предполагаемых участников группировки REvil, об аресте которых в январе сообщила ФСБ России, приостановилось. Американские коллеги так и не предоставили информации о жертвах и причиненном ущербе, поэтому подозреваемых можно обвинить только махинациях с банковскими картами двух граждан США, разыскать которых не представляется возможным.

Напомним, аресты в России были проведены с подачи американцев в рамках сотрудничества двух стран по вопросам кибербезопасности. В ходе недавнего интервью замглавы Совбеза РФ Олег Храмов рассказал «Российской газете», что в прошлом году заокеанские партнеры попросили под любым предлогом арестовать «главного хакера» — россиянина по фамилии Пузыревский, и предоставили его IP-адрес.

Российским спецслужбам удалось выяснить, что речь идет о рестораторе Данииле Пузыревском из Санкт-Петербурга. Попутно были идентифицированы 13 предполагаемых соучастников операций REvil, а также установлены две жертвы. Ими оказались проживающие в США мексиканцы, у которых подозреваемые, по версии следствия, дистанционно украли деньги, впоследствии потратив их в интернет-магазинах, с оплатой товаров по электронным средствам связи.

В России возбудили уголовное дело в соответствии с ч. 2 ст. 187 УК (неправомерное использование средств платежа в составе преступной группы), однако на том все и остановилось. Американская сторона, по словам Храмова, так и не предоставила обещанных дополнительных доказательств и даже не подтвердила ущерб от вымогательства. Более того, россиянам сообщили, что США в одностороннем порядке выходят из совместной рабочей группы и закрывают канал связи.

Адвокат одного из задержанных решил воспользоваться затишьем и добиться освобождения своего клиента. С этой целью он обратился к Храмову, отметив, что в уголовном деле до сих пор нет потерпевших и не указан ущерб, причиненный обвиняемыми. Допросов в СИЗО не проводится, поэтому защита просит генерала посодействовать в изменении меры пресечения, а затем — в прекращении уголовного преследования.

«На мой взгляд, разумным выходом из этой ситуации была бы сделка обвиняемых с Генпрокуратурой, — заявил «Ъ» автор прошения Игорь Вагин. — В ее рамках фигуранты получили бы освобождение от уголовной ответственности».

Адвокат также отметил, что изъятые денежные средства по условиям сделки могли бы быть потрачены на благие нужды, а «уникальный опыт» фигурантов дела наверняка пригодился бы российским спецслужбам.",1,0,https://www.anti-malware.ru/news/2022-05-27-111332/38767
