News,InfSec,FAKE?,Link
"Группа “М.Видео-Эльдорадо” создала собственную ИТ-компанию. Как пишет РБК, “дочку” строят на базе провайдера финтех-сервисов “Директ Кредит”, которую купили осенью за 1,3 млрд рублей.

Новая компания “М.Тех” займется развитием big data и новых ИТ-продуктов. Предполагается, что аналитики и технические специалисты “М.Видео” накопили достаточно опыты, чтобы выстроить отдельную структуру. “М.Тех” станет внешним партнерам головного офиса, а в будущем планирует предлагать свои ИТ-решения и другим участникам рынка.

Собеседники издания считают, что за общими словами про инновации может стоять желание инициатора воспользоваться льготами для айтишников.

“Пока я ничего не слышал про ИТ-команду «М.Видео-Эльдорадо» как про стоящих специалистов, — комментирует новость председатель Ассоциации участников рынка данных Иван Бегтин. — Если проанализировать компании, которые регистрируются сейчас как айтишные, то можно понять, что их основное направление деятельности совершенно другое”.

Напомним, на фоне массовой иммиграции ИТ-специалистов, власти в марте выкатили новый пакет льгот. Это и нулевая ставка на прибыль до конца 2024 года, и льготные кредиты с ипотекой, и отсрочка от армии для айтишников.

Слившись в 2018 году с конкурентом “Эльдорадо”, “М.Видео-Эльдорадо” лидирует на рынке электроники и бытовой техники. Ретейлер не первый придумал выделить ИТ-дочку из большого бизнеса. Так уже делали Сбербанк и X5 Group.

Создать свой “ИТ-дом” сейчас несложно, недавно даже одна из больниц Московской области получила такой статус. Специалисты напоминают, что “построить — не значит жить”: доказывать, что ты — айтишник всё равно придется в налоговой.",0,0,https://www.anti-malware.ru/news/2022-05-11-118537/38662
"Анализ образцов REvil/Sodinokibi, обнаруженных в марте и апреле, показал их функциональное сходство с семплом полугодовой давности. Эксперты Secureworks также обнаружили модификации кода, которые позволяют говорить о новом цикле разработки и возобновлении операций, связанных с этим шифровальщиком.

По словам исследователей, изменения привносились в код постепенно и пока оформлены как версия 1.0.0 (найденный в октябре схожий образец был помечен как версия 2.08). Аналитики убеждены, что создатель новых семплов имел доступ к исходникам REvil — это также подтверждают данные BleepingComputer.

Ответственность за реанимацию увядшего RaaS-сервиса (Ransomware-as-a-Service, шифровальщик как услуга) эксперты возлагают на бывшего аффилиата —кибергруппу, которую в Secureworks отслеживают под именем Gold Southfield. Напомним, в ИБ-сообществе заговорили о возможном возврате REvil после обнаружения в сети Tor новых сайтов зловреда — для публикации данных, украденных у жертв (свыше 250 организаций с 2019 года), и для контроля платежей.

В конце прошлого месяца Avast сообщила о выявлении нового семпла REvil. Обновленный зловред оказался не в состоянии шифровать файлы, он только добавлял к ним случайное расширение — как оказалось, из-за бага. Проведенное в Secureworks исследование показало, что вирусописатель нашел ошибку и должным образом исправил.

Аналитики также отметили ряд нововведений, в том числе следующие:

скорректирована логика расшифровки строк кода (введен новый аргумент командной строки);

изменен способ хранения конфигурационной структуры и 32-байтового ключа дешифрации в секции данных;

заменены вшитые в код публичные ключи (один из них используется для защиты ключа, создаваемого зловредом для шифрования файлов, другой — для защиты сессионных данных, таких как ID аффилиата, имя жертвы, информация о дисках и т. п.);

изменен формат отслеживания аффилиатов (теперь с этой целью используется GUID);

отключены проверки региональных настроек системы, то есть REvil стал космополитом;

узаконены новые onion-домены — они теперь присутствуют в тексте записки с требованием выкупа, которую шифровальщик оставляет в системе.

Примечательно, что владельцы возрожденного RaaS-сервиса предпочитают именовать его Sodinokibi — видимо, чтобы избавиться от ассоциаций с громкими атаками REvil, из-за которых прежние операции пришлось свернуть.",1,0,https://www.anti-malware.ru/news/2022-05-11-114534/38661
"Как стало известно «Ъ», расследование деятельности предполагаемых участников группировки REvil, об аресте которых в январе сообщила ФСБ России, приостановилось. Американские коллеги так и не предоставили информации о жертвах и причиненном ущербе, поэтому подозреваемых можно обвинить только махинациях с банковскими картами двух граждан США, разыскать которых не представляется возможным.

Напомним, аресты в России были проведены с подачи американцев в рамках сотрудничества двух стран по вопросам кибербезопасности. В ходе недавнего интервью замглавы Совбеза РФ Олег Храмов рассказал «Российской газете», что в прошлом году заокеанские партнеры попросили под любым предлогом арестовать «главного хакера» — россиянина по фамилии Пузыревский, и предоставили его IP-адрес.

Российским спецслужбам удалось выяснить, что речь идет о рестораторе Данииле Пузыревском из Санкт-Петербурга. Попутно были идентифицированы 13 предполагаемых соучастников операций REvil, а также установлены две жертвы. Ими оказались проживающие в США мексиканцы, у которых подозреваемые, по версии следствия, дистанционно украли деньги, впоследствии потратив их в интернет-магазинах, с оплатой товаров по электронным средствам связи.

В России возбудили уголовное дело в соответствии с ч. 2 ст. 187 УК (неправомерное использование средств платежа в составе преступной группы), однако на том все и остановилось. Американская сторона, по словам Храмова, так и не предоставила обещанных дополнительных доказательств и даже не подтвердила ущерб от вымогательства. Более того, россиянам сообщили, что США в одностороннем порядке выходят из совместной рабочей группы и закрывают канал связи.

Адвокат одного из задержанных решил воспользоваться затишьем и добиться освобождения своего клиента. С этой целью он обратился к Храмову, отметив, что в уголовном деле до сих пор нет потерпевших и не указан ущерб, причиненный обвиняемыми. Допросов в СИЗО не проводится, поэтому защита просит генерала посодействовать в изменении меры пресечения, а затем — в прекращении уголовного преследования.

«На мой взгляд, разумным выходом из этой ситуации была бы сделка обвиняемых с Генпрокуратурой, — заявил «Ъ» автор прошения Игорь Вагин. — В ее рамках фигуранты получили бы освобождение от уголовной ответственности».

Адвокат также отметил, что изъятые денежные средства по условиям сделки могли бы быть потрачены на благие нужды, а «уникальный опыт» фигурантов дела наверняка пригодился бы российским спецслужбам.",1,0,https://www.anti-malware.ru/news/2022-05-11-111332/38660
"Цыганский трюк “удвой свои сбережения” жив и прекрасно себя чувствует. Специалисты антивируса McAfee обратили внимание на видеоролики, в которых Илон Маск агитирует перевести криптовалюту на чужой кошелек.

Для манипуляции преступники используют конференцию инвестиционного холдинга Ark Invest «The ₿ Word» годичной давности. На стриме Илон Макс, Джек Дорси и Кэти Вуд рассуждают о рынке криптовалюты. На этот крючок хакеры и сажают доверчивых вкладчиков.

Ссылки на мошеннические сайты вмонтированы заставками в исходное видео конференции.

В McAfee нашли три десятка подобных сайтов. Только за 5 мая киберпреступники “увели” 280 тыс. долларов. Общая сумма переводов к моменту публикации превышает 1,3 миллиона.

Для убедительности хакеры используют домены с подходящим набором триггерных слов и комбинаций: Tesla, Elon Musk, Ark Invest.

На YouTube больше десятка сомнительных каналов, опирающихся на популярный стрим миллиардеров о криптовалюте, на них от ста тысяч до миллиона подписчиков. Скорее всего, просмотры были накручены или угнаны вместе с каналом.

YouTube каждый день удаляет подобный контент, но хакеры снова множат скимминговые каналы и сайты. Схема жизнеспособна еще и потому, что сами владельцы криптокошельков слишком доверчивы и готовы на любые авантюры в поисках новых решений увеличить капитал.

Сам Ark Invest открестился от причастности к махинациям еще 3 недели назад, закрепив предупреждение о хакерах на официальном YouTube-канале фонда:",0,0,https://www.anti-malware.ru/news/2022-05-11-118537/38659
"Новая порция вредоносных приложений для мобильных устройств на Android, распространяющая Joker, пробралась в официальный магазин Google Play Store. На угрозу обратили внимание специалисты «Лаборатории Касперского».

Зловред Joker — частый гость в Google Play Store, прикрывающийся с виду безобидным софтом. Попав на устройство пользователя, «Джокер» крадёт текстовые сообщения, списки контактов, информацию о девайсе, а также может осуществлять мошеннические действия посредством СМС.

В прошлый раз, когда вредоноса нашли в официальном магазине приложений, он прятался за программой Smart TV remote. Несмотря на все меры, которые предпринимает Google, находчивым авторам Joker каждый раз удаётся найти лазейку для проникновения на площадку интернет-гиганта.

«Операторы трояна часто распространяют его в Google Play по следующей схеме: скачивают легитимные приложения, добавляют к ним вредоносный код, заливают софт заново в магазин под другим именем», — объясняет в отчёте Игорь Головин из «Лаборатории Касперского».

Таким образом, надоедливый троян может прикрыться мессенджерами, программами для контроля здоровья, PDF-сканерами и тому подобным. После установки «Джокер» запрашивает в системе ряд разрешений, среди которых доступ к текстовым сообщениям и уведомлениям. Эта функциональность используется для подписки жертвы на платные сервисы без её ведома.

Обходить защитные функции Google Play Store «Джокеру» помогает так называемый «механизм спячки», активирующий вредоносную составляющую только после прохождения всех проверок.

В этот раз исследователи из Kaspersky обратили внимание на три приложения, распространяющие Android-троян:",1,0,https://www.anti-malware.ru/news/2022-05-11-111332/38658
"Как стало известно «Ъ», расследование деятельности предполагаемых участников группировки REvil, об аресте которых в январе сообщила ФСБ России, приостановилось. Американские коллеги так и не предоставили информации о жертвах и причиненном ущербе, поэтому подозреваемых можно обвинить только махинациях с банковскими картами двух граждан США, разыскать которых не представляется возможным.

Напомним, аресты в России были проведены с подачи американцев в рамках сотрудничества двух стран по вопросам кибербезопасности. В ходе недавнего интервью замглавы Совбеза РФ Олег Храмов рассказал «Российской газете», что в прошлом году заокеанские партнеры попросили под любым предлогом арестовать «главного хакера» — россиянина по фамилии Пузыревский, и предоставили его IP-адрес.

Российским спецслужбам удалось выяснить, что речь идет о рестораторе Данииле Пузыревском из Санкт-Петербурга. Попутно были идентифицированы 13 предполагаемых соучастников операций REvil, а также установлены две жертвы. Ими оказались проживающие в США мексиканцы, у которых подозреваемые, по версии следствия, дистанционно украли деньги, впоследствии потратив их в интернет-магазинах, с оплатой товаров по электронным средствам связи.

В России возбудили уголовное дело в соответствии с ч. 2 ст. 187 УК (неправомерное использование средств платежа в составе преступной группы), однако на том все и остановилось. Американская сторона, по словам Храмова, так и не предоставила обещанных дополнительных доказательств и даже не подтвердила ущерб от вымогательства. Более того, россиянам сообщили, что США в одностороннем порядке выходят из совместной рабочей группы и закрывают канал связи.

Адвокат одного из задержанных решил воспользоваться затишьем и добиться освобождения своего клиента. С этой целью он обратился к Храмову, отметив, что в уголовном деле до сих пор нет потерпевших и не указан ущерб, причиненный обвиняемыми. Допросов в СИЗО не проводится, поэтому защита просит генерала посодействовать в изменении меры пресечения, а затем — в прекращении уголовного преследования.

«На мой взгляд, разумным выходом из этой ситуации была бы сделка обвиняемых с Генпрокуратурой, — заявил «Ъ» автор прошения Игорь Вагин. — В ее рамках фигуранты получили бы освобождение от уголовной ответственности».

Адвокат также отметил, что изъятые денежные средства по условиям сделки могли бы быть потрачены на благие нужды, а «уникальный опыт» фигурантов дела наверняка пригодился бы российским спецслужбам.",1,0,https://www.anti-malware.ru/news/2022-05-11-111332/38657
"Российский видеохостинг RuTube «лежит» уже третий день, хотя сам сервис отрицает фатальные последствия взлома. APT-атака началась в ночь на 9 мая. Утром платформа, на которую два месяца грузили петабайты архивов, переводили госканалы и блоги, перестала отвечать.

Примерно в это же время хакеры перехватили «Сервис-ТВ», который транслирует бегущую строку и программу передач для платного телевидения. Вместо анонсов Парада Победы абоненты «Ростелекома», МТС и НТВ+ увидели антивоенные сообщения. То же случилось и с расписанием на Яндексе. Скриншоты экранов посыпались в телеграм-каналы.

Не успели операторы «почистить» ленту анонсов, как сдалась сама «Лента.ру». Тексты с заголовками и критикой появились на главной странице сайта. Сначала их публикацию тоже приписали хакерам, но позже ответственность на себя взяли три сотрудников издания. Они разместили спорные материалы без согласования с редакцией. Контент быстро удалили.

Больше всех пострадал RuTube. Весь день 9 мая на хостинге «велись восстановительные работы». 10 мая в прессу утекла информация о том, что хакеры стёрли исходный код, а оживить хостинг невозможно. В самом RuTube «слив» опровергают. Представители сервиса заявляют, что все библиотеки целы, исходный код доступен. Сроки “починки” не называются:

«В результате атаки на RuTube было поражено более 75% баз и инфраструктуры основной версии и 90% резервных копий и кластеров для восстановления баз данных».

В самом RuTube заявляли, что в марте количество посещений платформы удвоилось, а число уникальных пользователей превысило 21 миллион. Майская кибератака на RuTube стала самой мощной в истории сервиса. На момент публикации хостинг по-прежнему недоступен.

Update: компания Group-IB опровергает причастность к взлому RuTube",1,0,https://www.anti-malware.ru/news/2022-05-11-118537/38656
